{"base_site":{"path":"/srv/sparkinterval-operator/site/azure-cpu-materializer-site.json","sha256":"0000000000000000000000000000000000000000000000000000000000000000","size_bytes":0},"dirichlet_postcheck":{"flint_source_root":"/srv/sparkinterval-source/flint-3.6.0","predecessor_certificate_archive":{"path":"/srv/sparkinterval-operator/predecessors/platt-dirichlet-theorem-7-1.tar","sha256":"0000000000000000000000000000000000000000000000000000000000000000","size_bytes":0},"predecessor_trusted_receipt":{"path":"/srv/sparkinterval-operator/predecessors/platt-dirichlet-theorem-7-1-receipt.json","sha256":"0000000000000000000000000000000000000000000000000000000000000000","size_bytes":0},"python_flint_source_root":"/srv/sparkinterval-source/python-flint-0.9.0","python_flint_wheel":{"path":"/srv/sparkinterval-operator/runtime/python_flint-0.9.0-cp312-cp312-linux_x86_64.whl","sha256":"0000000000000000000000000000000000000000000000000000000000000000","size_bytes":0}},"kind":"sparkinterval.azure.cpu.dirichlet-postcheck-materializer-site.v1","schema_version":1}
